{
  "schema_version": 1,
  "probe_id": "probe_a362d7c0318e5ddf",
  "run_id": "diagnosis_run_615b6a3d768a38c1",
  "seed_set_id": "seed_set_b7ef6f28a9934464",
  "question_id": "question_eddea7f8c6e411f3",
  "question_text": "定制儿童芭蕾tutu裙要向厂家确认哪些条件？",
  "question_family": "supplier_capability",
  "platform": "DeepSeek",
  "provider": "not_configured_placeholder",
  "adapter_kind": "manual",
  "model": null,
  "attempted_at": "2026-08-07T08:00:21Z",
  "status": "unavailable",
  "raw_snapshot_path": null,
  "raw_content_hash": null,
  "error": {
    "code": "provider_api_not_configured",
    "message": "DeepSeek API 未配置；本记录仅为计划占位，不代表平台回答或品牌未提及。",
    "retryable": true
  },
  "analysis": null,
  "latest_analysis_revision_id": null
}
