{
  "schema_version": 1,
  "probe_id": "probe_cdc0431c2d866cad",
  "run_id": "diagnosis_run_69aff52f92169c48",
  "seed_set_id": "seed_set_d9eff79fae08a16d",
  "question_id": "question_b4cd420aca413399",
  "question_text": "有哪些可以做六爻或八字解读的命理AI？",
  "question_family": "supplier_capability",
  "platform": "WebSearch",
  "provider": "cursor_web_search",
  "adapter_kind": "manual",
  "model": "web_search",
  "attempted_at": "2026-08-07T13:01:24Z",
  "status": "success",
  "raw_snapshot_path": "diagnosis/runs/diagnosis_run_69aff52f92169c48/raw/probe_cdc0431c2d866cad.md",
  "raw_content_hash": "e3f8cec36429a2a8404c5ded5e2c8637f3311a4433402d0d3aab3d363f11cda6",
  "error": null,
  "analysis": {
    "schema_version": 1,
    "target_mentioned": false,
    "actively_recommended": false,
    "top_n_rank": null,
    "competitors": [
      "AuraMate灵伴",
      "FateTell",
      "DeepOracle",
      "知命",
      "天机爻",
      "Arcana",
      "爻知",
      "问天机"
    ],
    "citations": [],
    "negative_risk_mentioned": false,
    "sentiment": "unknown",
    "notes": "人工修订：裸搜「知鱼」多为知鱼智联同名干扰；仅当出现 zhiyu.hk/易学工具·知鱼 记为目标品牌提及。WebSearch 不是 AI 对话平台。"
  },
  "latest_analysis_revision_id": "analysis_revision_49e8c479789fec03"
}
